{
  "source": {
    "id": "ui-block-sites",
    "name": "Copy-paste UI block sites (hand-picked)",
    "url": "https://github.com/yoorrard/codeitso",
    "license": "Hand-written list of public sites (name, link, Korean one-liner by 코드잇소). summary = the site's own meta description fetched on the date above. license is filled only where the site's license page was read; otherwise follow preview.licenseUrl.",
    "note": "Sites behind bot protection answer 403/429/503 to scripts; they are kept (linkStatus shows the code). Tag link-check-failed marks links that did not answer at all. metrics.siteRank = global Chrome UX Report rank bucket of the item's site (1000, 5000, 10000, 50000, 100000, 500000, 1000000; Chrome UX Report top lists (CC BY 4.0, via github.com/zakird/crux-top-lists), 2026-10), set only when the item has no other metric. Used only for sorting."
  },
  "fetchedAt": "2026-10-28",
  "count": 7,
  "items": [
    {
      "id": "curated:21st-dev",
      "name": "21st.dev",
      "kind": "ui-blocks",
      "category": "design",
      "summary": "12,000+ hand-crafted React and Tailwind CSS components, templates, and shadcn themes by real design engineers. Preview live, install with one command — for you and your AI agent.",
      "summaryKo": "shadcn/ui 기반 React 컴포넌트·블록 장터. shadcn 명령으로 바로 설치한다.",
      "written": "codeshopper",
      "url": "https://21st.dev",
      "source": {
        "name": "21st.dev",
        "url": "https://21st.dev"
      },
      "tags": [
        "copy-paste",
        "react",
        "shadcn"
      ],
      "preview": {
        "type": "site",
        "url": "https://21st.dev",
        "linkStatus": 200
      },
      "use": {
        "docs": "https://21st.dev"
      },
      "fetchedAt": "2026-10-20",
      "metrics": {
        "siteRank": 100000
      }
    },
    {
      "id": "curated:aceternity-ui",
      "name": "Aceternity UI",
      "kind": "ui-blocks",
      "category": "design",
      "summary": "Aceternity UI is a React component library with 200+ copy-paste components, blocks, and landing page templates built with Tailwind CSS and Motion.",
      "summaryKo": "화려한 움직임이 들어간 React·Tailwind 컴포넌트를 복사해 쓰는 곳. 일부 유료.",
      "written": "codeshopper",
      "url": "https://ui.aceternity.com",
      "source": {
        "name": "Aceternity UI",
        "url": "https://ui.aceternity.com"
      },
      "tags": [
        "animation",
        "copy-paste",
        "freemium",
        "react",
        "tailwind"
      ],
      "preview": {
        "type": "site",
        "url": "https://ui.aceternity.com",
        "linkStatus": 200,
        "pricing": "freemium"
      },
      "use": {
        "docs": "https://ui.aceternity.com"
      },
      "fetchedAt": "2026-10-20",
      "metrics": {
        "siteRank": 1000000
      }
    },
    {
      "id": "curated:hyperui",
      "name": "HyperUI",
      "kind": "ui-blocks",
      "category": "design",
      "summary": "Free, open-source Tailwind CSS components for modern web development. Copy-paste ready components to build beautiful, responsive websites faster.",
      "summaryKo": "무료 Tailwind CSS 컴포넌트 모음.",
      "written": "codeshopper",
      "url": "https://www.hyperui.dev",
      "source": {
        "name": "HyperUI",
        "url": "https://www.hyperui.dev"
      },
      "tags": [
        "copy-paste",
        "tailwind"
      ],
      "preview": {
        "type": "site",
        "url": "https://www.hyperui.dev",
        "linkStatus": 403
      },
      "use": {
        "docs": "https://www.hyperui.dev"
      },
      "fetchedAt": "2026-10-28",
      "metrics": {
        "siteRank": 1000000
      }
    },
    {
      "id": "curated:shadcnblocks",
      "name": "Shadcnblocks",
      "kind": "ui-blocks",
      "category": "design",
      "summary": "Discover hundreds of extra shadcn/ui blocks and Shadcn UI components. Shadcnblocks is a premium component library built with Shadcn UI, React & Tailwind.",
      "summaryKo": "shadcn/ui로 만든 랜딩·앱 블록 모음. 무료와 유료가 섞여 있다.",
      "written": "codeshopper",
      "url": "https://www.shadcnblocks.com",
      "source": {
        "name": "Shadcnblocks",
        "url": "https://www.shadcnblocks.com"
      },
      "tags": [
        "copy-paste",
        "freemium",
        "shadcn"
      ],
      "preview": {
        "type": "site",
        "url": "https://www.shadcnblocks.com",
        "linkStatus": 200,
        "pricing": "freemium"
      },
      "use": {
        "docs": "https://www.shadcnblocks.com"
      },
      "fetchedAt": "2026-10-20",
      "metrics": {
        "siteRank": 500000
      }
    },
    {
      "id": "curated:tailblocks",
      "name": "Tailblocks",
      "kind": "ui-blocks",
      "category": "design",
      "summary": "Ready-to-use Tailwind CSS blocks",
      "summaryKo": "랜딩 페이지 블록 60여 개를 Tailwind 코드로 주는 곳.",
      "written": "codeshopper",
      "url": "https://tailblocks.cc",
      "source": {
        "name": "Tailblocks",
        "url": "https://tailblocks.cc"
      },
      "tags": [
        "copy-paste",
        "landing-page",
        "tailwind"
      ],
      "preview": {
        "type": "site",
        "url": "https://tailblocks.cc",
        "linkStatus": 200
      },
      "use": {
        "docs": "https://tailblocks.cc"
      },
      "fetchedAt": "2026-10-20"
    },
    {
      "id": "curated:tailwind-plus",
      "name": "Tailwind Plus (Tailwind UI)",
      "kind": "ui-blocks",
      "category": "design",
      "summary": "Beautiful UI components and templates by the creators of Tailwind CSS.",
      "summaryKo": "Tailwind CSS 제작팀이 만든 유료 컴포넌트·템플릿 모음. 무료 미리 보기가 있다.",
      "written": "codeshopper",
      "url": "https://tailwindcss.com/plus",
      "source": {
        "name": "Tailwind Plus (Tailwind UI)",
        "url": "https://tailwindcss.com/plus"
      },
      "tags": [
        "copy-paste",
        "paid",
        "tailwind"
      ],
      "preview": {
        "type": "site",
        "url": "https://tailwindcss.com/plus",
        "linkStatus": 200,
        "pricing": "paid"
      },
      "use": {
        "docs": "https://tailwindcss.com/plus"
      },
      "fetchedAt": "2026-10-20",
      "metrics": {
        "siteRank": 500000
      }
    },
    {
      "id": "curated:uiverse",
      "name": "Uiverse",
      "kind": "ui-blocks",
      "category": "design",
      "summary": "Uiverse (uiverse.io)",
      "summaryKo": "버튼·카드·로더 같은 UI 조각 수천 개를 HTML/CSS·Tailwind 코드로 복사해 쓰는 오픈소스 갤러리.",
      "written": "codeshopper",
      "url": "https://uiverse.io",
      "source": {
        "name": "Uiverse",
        "url": "https://uiverse.io"
      },
      "license": "MIT",
      "tags": [
        "copy-paste",
        "css",
        "open-source",
        "tailwind"
      ],
      "preview": {
        "type": "site",
        "url": "https://uiverse.io",
        "linkStatus": 403,
        "licenseUrl": "https://github.com/uiverse-io/galaxy"
      },
      "use": {
        "docs": "https://github.com/uiverse-io/galaxy"
      },
      "fetchedAt": "2026-10-20",
      "metrics": {
        "siteRank": 500000
      }
    }
  ]
}
